Value,es,eu,en,Disaggregation combinations using this value,Number of indicators
ICT,Alguna habilidad informática,Trebetasun informatikoren bat behintzat,ICT,36,1
ICTCPT,Copiar o mover ficheros o carpetas,Fitxategiak edo karpetak kopiatu edo mugitu,ICTCPT,36,1
ICTPRGM,Programar en un lenguaje de programación,Programazio-lengoaia batean programatzea,ICTPRGM,36,1
ICTPRVCY,"Cambiar la configuración de cualquier software, incluídos el sistema operativo y los programas de seguridad","Edozein softwareren konfigurazioa aldatzea, sistema eragilea eta segurtasun-programak barne",ICTPRVCY,36,1
ICTPST,"Crear presentaciones o documentos que integren texto, imágenes, tablas o gráficos","Testua, irudiak, taulak edo grafikoak osatzen dituzten aurkezpenak edo dokumentuak sortzea",ICTPST,36,1
ICTSFWR,Instalar software o aplicaciones(apps),Softwarea edo aplikazioak instalatzea (app-ak),ICTSFWR,36,1
ICTSSHT,Usar hojas de cálculo,Kalkulu-orriak erabiltzea,ICTSSHT,36,1
ICTTRFF,"Transferir ficheros entre el ordenador y otros dispositivos (cámaras digitales, teléfonos móviles, mp3 o mp4)","Fitxategiak ordenagailuaren eta beste gailu batzuen artean transferitzea (kamera digitalak, telefono mugikorrak, mp3 edo mp4)",ICTTRFF,36,1
