Value,es,eu,en,Disaggregation combinations using this value,Number of indicators
SE_ACS_CMPTR,Conexión a internet,Ordenadores con fines pedagógicos ,Ordenadores con fines pedagógicos ,1,1
SE_ACS_ELECT,Electricidad,Electricidad,Electricidad,1,1
SE_ACS_H2O,Agua potable,Agua potable,Agua potable,1,1
SE_ACS_HNDWSH,Lavado de manos,Instalaciones básicas para el lavado de manos,Instalaciones básicas para el lavado de manos,1,1
SE_ACS_SANIT,Baños separados por sexo,Baños separados por sexo,Baños separados por sexo,1,1
